{
  "document_id": "KB-TC-REPO-001",
  "version": "2026.05.01.151511",
  "status": "Exported from ingestion DB structured test-case inventory.",
  "title": "Knowledge Base Test Case Repository",
  "source_workbook": "test_data/TestCases.xlsx",
  "cases": [
    {
      "test_case_id": "TC-001",
      "requirement_ids": [
        "REQ-FR-002",
        "REQ-FR-003",
        "REQ-FR-012",
        "REQ-FR-014",
        "REQ-FR-020",
        "REQ-FR-022",
        "REQ-FR-030",
        "REQ-FR-031",
        "REQ-FR-034",
        "REQ-FR-040",
        "REQ-FR-043",
        "REQ-FR-044",
        "REQ-FR-045"
      ],
      "title": "Maker submits BUY, checker approves, dashboard reflects one approved trade",
      "objective": "Validate the core maker-checker happy path from login through approval and approved-only dashboard count.",
      "priority": "P1",
      "suite": "S-1 Smoke",
      "tags": [
        "@smoke",
        "@maker",
        "@checker",
        "@approval",
        "@dashboard"
      ],
      "steps": [
        {
          "requirement_id": "REQ-FR-002",
          "step_number": 1,
          "step_description": "Login as maker using documented credentials.",
          "expected_output": "Dashboard page loads and navbar shows admin (maker).",
          "test_data": "username=admin,password=admin"
        },
        {
          "requirement_id": "REQ-FR-012",
          "step_number": 2,
          "step_description": "Open Trading menu and navigate to New Trade.",
          "expected_output": "New Trade form is visible.",
          "test_data": "target=nav-new-trade"
        },
        {
          "requirement_id": "REQ-FR-030",
          "step_number": 3,
          "step_description": "Select BUY, Technology, AAPL, Cash, quantity 100, Day Order.",
          "expected_output": "All required trade form fields are populated.",
          "test_data": "side=BUY,sector=Technology,ticker=AAPL,accountType=Cash,quantity=100,timeInForce=Day Order"
        },
        {
          "requirement_id": "REQ-FR-031",
          "step_number": 4,
          "step_description": "Wait for ticker price and total value to calculate.",
          "expected_output": "Current Price is 178.50 and Total Value is 17850.00.",
          "test_data": "ticker=AAPL,expectedPrice=178.50,expectedTotal=17850.00"
        },
        {
          "requirement_id": "REQ-FR-034",
          "step_number": 5,
          "step_description": "Submit the order.",
          "expected_output": "Success toast confirms Order TX-1001 and workflow moves toward approval queue.",
          "test_data": "expectedTxId=TX-1001"
        },
        {
          "requirement_id": "REQ-FR-040",
          "step_number": 6,
          "step_description": "Open Approval Queue as maker before approval.",
          "expected_output": "Queue shows Pending: 1 and includes BUY AAPL quantity 100.",
          "test_data": "expectedPending=1,ticker=AAPL,side=BUY,quantity=100"
        },
        {
          "requirement_id": "REQ-FR-014",
          "step_number": 7,
          "step_description": "Logout maker.",
          "expected_output": "Login page is visible and maker session is cleared.",
          "test_data": ""
        },
        {
          "requirement_id": "REQ-FR-003",
          "step_number": 8,
          "step_description": "Login as checker.",
          "expected_output": "Dashboard page loads and navbar shows checker (checker).",
          "test_data": "username=checker,password=chscker@123"
        },
        {
          "requirement_id": "REQ-FR-043",
          "step_number": 9,
          "step_description": "Open Approval Queue and approve the AAPL BUY row.",
          "expected_output": "Approve action completes for TX-1001.",
          "test_data": "ticker=AAPL,side=BUY"
        },
        {
          "requirement_id": "REQ-FR-044",
          "step_number": 10,
          "step_description": "Observe approval feedback.",
          "expected_output": "Toast displays Trade TX-1001 approved.",
          "test_data": "expectedToast=Trade TX-1001 approved"
        },
        {
          "requirement_id": "REQ-FR-045",
          "step_number": 11,
          "step_description": "Refresh or revisit Approval Queue.",
          "expected_output": "Queue shows Pending: 0 and the approved row is removed.",
          "test_data": "expectedPending=0"
        },
        {
          "requirement_id": "REQ-FR-020",
          "step_number": 12,
          "step_description": "Navigate to Dashboard.",
          "expected_output": "Dashboard includes the approved AAPL trade and excludes pending-only rows.",
          "test_data": "ticker=AAPL"
        },
        {
          "requirement_id": "REQ-FR-022",
          "step_number": 13,
          "step_description": "Verify Dashboard total count.",
          "expected_output": "Total Trades: 1 is displayed.",
          "test_data": "expectedCount=1"
        }
      ]
    },
    {
      "test_case_id": "TC-002",
      "requirement_ids": [
        "REQ-FR-002",
        "REQ-FR-020",
        "REQ-FR-022",
        "REQ-FR-033",
        "REQ-FR-041",
        "REQ-FR-042"
      ],
      "title": "Two pending trades are counted in queue and absent from dashboard until approval",
      "objective": "Prove pending trades are isolated to the approval queue and do not inflate approved dashboard totals.",
      "priority": "P1",
      "suite": "S-4 Detailed Regression",
      "tags": [
        "@regression",
        "@maker",
        "@queue",
        "@dashboard"
      ],
      "steps": [
        {
          "requirement_id": "REQ-FR-002",
          "step_number": 1,
          "step_description": "Login as maker.",
          "expected_output": "Navbar shows admin (maker).",
          "test_data": "username=admin,password=admin"
        },
        {
          "requirement_id": "REQ-FR-033",
          "step_number": 2,
          "step_description": "Create BUY AAPL 100 Cash Day Order.",
          "expected_output": "First trade is submitted and routed to pending approval.",
          "test_data": "side=BUY,sector=Technology,ticker=AAPL,accountType=Cash,quantity=100,timeInForce=Day Order"
        },
        {
          "requirement_id": "REQ-FR-033",
          "step_number": 3,
          "step_description": "Create SELL AAPL 100 Cash Day Order.",
          "expected_output": "Second trade is submitted and routed to pending approval.",
          "test_data": "side=SELL,sector=Technology,ticker=AAPL,accountType=Cash,quantity=100,timeInForce=Day Order"
        },
        {
          "requirement_id": "REQ-FR-042",
          "step_number": 4,
          "step_description": "Navigate to Approval Queue.",
          "expected_output": "Pending: 2 is displayed.",
          "test_data": "expectedPending=2"
        },
        {
          "requirement_id": "REQ-FR-041",
          "step_number": 5,
          "step_description": "Inspect queue columns and row values.",
          "expected_output": "TX-ID, Side, Ticker, Qty, Price, Total, Action columns are visible with both AAPL rows.",
          "test_data": "expectedColumns=TX-ID|Side|Ticker|Qty|Price|Total|Action"
        },
        {
          "requirement_id": "REQ-FR-020",
          "step_number": 6,
          "step_description": "Navigate to Dashboard without approving either trade.",
          "expected_output": "Dashboard does not show the pending AAPL trades.",
          "test_data": "ticker=AAPL"
        },
        {
          "requirement_id": "REQ-FR-022",
          "step_number": 7,
          "step_description": "Verify dashboard approved count remains zero.",
          "expected_output": "Total Trades: 0 is displayed.",
          "test_data": "expectedCount=0"
        }
      ]
    },
    {
      "test_case_id": "TC-003",
      "requirement_ids": [
        "REQ-FR-002",
        "REQ-FR-003",
        "REQ-FR-014",
        "REQ-FR-033",
        "REQ-FR-043",
        "REQ-FR-050",
        "REQ-FR-051"
      ],
      "title": "Approved BUY and matching SELL become Matched in Trade List",
      "objective": "Validate the matched-pair lifecycle after checker approval of opposite-side trades with the same ticker and quantity.",
      "priority": "P1",
      "suite": "S-1 Smoke",
      "tags": [
        "@smoke",
        "@maker",
        "@checker",
        "@matching",
        "@trade-list"
      ],
      "steps": [
        {
          "requirement_id": "REQ-FR-002",
          "step_number": 1,
          "step_description": "Login as maker.",
          "expected_output": "Maker session is established.",
          "test_data": "username=admin,password=admin"
        },
        {
          "requirement_id": "REQ-FR-033",
          "step_number": 2,
          "step_description": "Create BUY JPM 50 Margin Day Order.",
          "expected_output": "BUY JPM is submitted as pending approval.",
          "test_data": "side=BUY,sector=Financials,ticker=JPM,accountType=Margin,quantity=50,timeInForce=Day Order"
        },
        {
          "requirement_id": "REQ-FR-014",
          "step_number": 3,
          "step_description": "Logout maker.",
          "expected_output": "Login page is visible.",
          "test_data": ""
        },
        {
          "requirement_id": "REQ-FR-003",
          "step_number": 4,
          "step_description": "Login as checker.",
          "expected_output": "Checker session is established.",
          "test_data": "username=checker,password=chscker@123"
        },
        {
          "requirement_id": "REQ-FR-043",
          "step_number": 5,
          "step_description": "Approve the pending BUY JPM row.",
          "expected_output": "BUY JPM row is approved and leaves queue.",
          "test_data": "ticker=JPM,side=BUY"
        },
        {
          "requirement_id": "REQ-FR-014",
          "step_number": 6,
          "step_description": "Logout checker.",
          "expected_output": "Login page is visible.",
          "test_data": ""
        },
        {